{
  "$schema": "https://json-schema.org/draft/2020-12/schema",
  "$id": "https://local/ngs_evidence_layer/metadata_schema.json",
  "title": "Publication metadata",
  "description": "Publication metadata used in working and archived packages. Confirmation overwrite history is optional for working-package compatibility.",
  "type": "object",
  "required": [
    "schema_version",
    "paper_id",
    "corpus",
    "stem",
    "publication_key",
    "citation",
    "citation_source",
    "citation_resolved_at",
    "source_filename",
    "source_sha256",
    "markdown_sha256",
    "created_at"
  ],
  "additionalProperties": false,
  "properties": {
    "schema_version": { "const": "1.1" },
    "paper_id": { "type": "string", "format": "uuid" },
    "corpus": { "type": "string", "minLength": 1 },
    "stem": { "type": "string", "minLength": 1 },
    "publication_key": {
      "type": "string",
      "pattern": "^[a-z0-9]+(-[a-z0-9]+)*$"
    },
    "citation": { "$ref": "#/$defs/citation" },
    "citation_source": {
      "enum": ["crossref-doi", "model-supplied-doi", "operator"]
    },
    "citation_resolved_at": {
      "anyOf": [
        { "type": "string", "format": "date-time" },
        { "type": "null" }
      ]
    },
    "source_filename": { "type": "string", "minLength": 1 },
    "source_sha256": { "type": ["string", "null"], "pattern": "^[a-f0-9]{64}$" },
    "markdown_sha256": { "type": "string", "pattern": "^[a-f0-9]{64}$" },
    "created_at": { "type": "string", "format": "date-time" },
    "version_history": {
      "type": "array",
      "minItems": 1,
      "uniqueItems": true,
      "items": { "type": "string", "minLength": 1 }
    },
    "latest_version": { "type": "string", "minLength": 1 }
  },
  "$defs": {
    "citation": {
      "type": "object",
      "required": [
        "authors",
        "title",
        "journal",
        "year",
        "volume",
        "issue",
        "pages",
        "doi",
        "display",
        "citation_incomplete"
      ],
      "additionalProperties": false,
      "properties": {
        "authors": {
          "type": "array",
          "minItems": 1,
          "items": { "type": "string", "minLength": 1 }
        },
        "title": { "type": "string", "minLength": 1 },
        "journal": { "type": "string" },
        "year": { "type": "integer", "minimum": 1950, "maximum": 2100 },
        "month": { "type": "string" },
        "volume": { "type": "string" },
        "issue": { "type": "string" },
        "pages": { "type": "string" },
        "doi": { "type": "string" },
        "display": { "type": "string", "minLength": 1 },
        "citation_incomplete": {
          "type": "array",
          "uniqueItems": true,
          "items": { "type": "string", "minLength": 1 }
        }
      }
    }
  }
}